### ISSUE TITLE
Export(Publish)하는 이벤트의 Timestamp 값을 소수점 이하 9자리까지 확장

### ISSUE THREAD

**Issue by syncpark** [aicers/giganto#264]
Giganto에서 외부로 Export(Publish)하는 이벤트의 Timestamp 값을 소수점 이하 9자리까지 표시되도록 수정해야 합니다.

Piglet에서 생성하는 혹은 덤프하는 패킷들의 시간(Giganto에서는 Key로 사용)의 중복을 방지하기 위해, 같은 값일 경우 나노(Nano) 초 단위에서 1씩 추가합니다. 이럴 경우 아래의 예처럼 소수점 이하 9자리까지 사용됩니다.

TCPDUMP에서 dump 파일을 확인: `tcpdump -n -r dump.pcap -tttt --time-stamp-precision=nanosecond`
```
2021-02-24 10:31:35.165491000 IP 192.168.205.95.51011 > 192.168.0.222.1443: Flags [.], ack 2294014002, win 512, length 0
2021-02-24 10:31:35.165491001 IP 192.168.0.8.49218 > 192.168.0.22.51820: Flags [P.], seq 65:129, ack 352, win 2047, length 64
2021-02-24 10:31:35.165495000 IP 192.168.0.8.1433 > 192.168.0.22.53146: Flags [P.], seq 0:41, ack 1, win 2050, length 41
2021-02-24 10:31:35.165495001 IP 192.168.0.22.51820 > 192.168.0.8.49218: Flags [P.], seq 352:496, ack 129, win 8207, length 144
```

지금의 Giganto v0.8.0-alpha.1 버전에서는 이벤트를 Export하거나 REconverge에게 Publish할 때 `%s%.6f` 형식을 사용하는데 이럴 경우 시간 값의 뒷부분 3자리 숫자가 없어집니다.

REconverge와 REview에서도 문제점을 확인하고 수정할 필요가 있습니다.
